{"base_sha": "aaaaaaaaaaaaaaaaaaaaaaaaaaaaaaaaaaaaaaaa", "blockers": [], "candidate_sha": "bbbbbbbbbbbbbbbbbbbbbbbbbbbbbbbbbbbbbbbb", "changed_paths": [], "completed_work": ["Completed synthetic discovery."], "decision_count": 1, "decisions_sha256": "a6c61ef848945fd65345f04ceecaea174d90fe1948a9abc89f23d3af0e29791f", "handoff_sha256": "ea5fdcbe591299067f2d58780bb6288e782316e46bcd1e8a48f70ec5639bea4a", "human_action_required": false, "issue_number": 10, "next_action": "Change src/resume.py checkpoint from partial to ready.", "pending_work": ["Change the recorded checkpoint to ready."], "phase": "implementation", "read_paths": [".ai-dev/handoff.md", "src/resume.py"], "repository": "shiroku46/eval-handoff", "schema_version": 1, "task_id": "issue-10", "updated_at": "2026-08-07T00:01:00Z"}