{"base_sha":"8888888888888888888888888888888888888888","blockers":[],"candidate_sha":"9999999999999999999999999999999999999999","changed_paths":[],"completed_work":["Completed synthetic discovery.","Recorded the superseding resume decision."],"decision_count":2,"decisions_sha256":"61b67337299df2db92cad449a225eef50fb5ce4903283b233da62a731096bde3","handoff_sha256":"63f32691d119cf2c2b9d06f2302e08636aa8db2690c02fadcd7a224bffab8a60","human_action_required":false,"issue_number":30,"next_action":"Change src/resume.py checkpoint from pending to done.","pending_work":["Change the recorded checkpoint to done."],"phase":"implementation","read_paths":[".ai-dev/handoff.md","src/resume.py"],"repository":"shiroku46/eval-resume-chain","schema_version":1,"task_id":"issue-30","updated_at":"2026-08-07T00:01:00Z"}