{"base_sha": "5555555555555555555555555555555555555555", "blockers": [], "candidate_sha": "6666666666666666666666666666666666666666", "changed_paths": [], "completed_work": ["Recorded an older candidate handoff."], "decision_count": 1, "decisions_sha256": "1c75bab3bb27606166e900b50b66aedd6d5d99950d90d7a522e22784bcca7ce5", "handoff_sha256": "04fe22ec6ed42918da99f7e45041ea5f8585a311ab7af6dff749bc54ca8b8fe8", "human_action_required": false, "issue_number": 15, "next_action": "Reject this stale handoff and keep current source unchanged.", "pending_work": ["Reject stale handoff against the current candidate."], "phase": "validation", "read_paths": [".ai-dev/handoff.md", "src/resume_guard.py"], "repository": "shiroku46/eval-stale-handoff", "schema_version": 1, "task_id": "issue-15", "updated_at": "2026-08-07T01:01:00Z"}